{
  "schema_version": "project-entry.v1",
  "id": "chroma-core.chroma",
  "name": "Chroma",
  "repo": {
    "owner": "chroma-core",
    "name": "chroma",
    "url": "https://github.com/chroma-core/chroma",
    "description": "Search infrastructure for AI",
    "stars": 28399,
    "forks": 2313,
    "pushed_at": "2026-06-12T09:41:03Z",
    "latest_release": {
      "tag": "1.5.9",
      "name": "1.5.9",
      "url": "https://github.com/chroma-core/chroma/releases/tag/1.5.9",
      "published_at": "2026-05-05T05:55:40Z"
    },
    "license": "Apache License 2.0",
    "topics": ["database", "rust", "ai", "agents", "ai-agents"],
    "archived": false
  },
  "review_state": "metadata_triaged",
  "measured_at": "2026-06-12",
  "node_fit": [
    {
      "node": "context_memory",
      "fit_level": "primary",
      "capability": "vector_memory",
      "hypothesis": "Chroma can support AI-native retrieval experiments for Context and Learning nodes."
    }
  ],
  "evidence": [
    {
      "type": "github_metadata",
      "url": "https://github.com/chroma-core/chroma",
      "note": "Repository metadata shows active pushes, Apache-2.0 license, AI/agent topics, and recent 1.5.9 release."
    }
  ],
  "risks": [
    "Persistence, deployment, and API stability need docs review.",
    "Needs comparison against Qdrant, LanceDB, and pgvector for real node memory tasks."
  ],
  "next_review_tasks": [
    "Review Chroma docs for local and server modes.",
    "Run minimal note ingestion and retrieval test.",
    "Record adapter shape for concept-learning memory."
  ]
}
